,title,score,id,url,author,author's karma
0,Meta Discussion Thread #5,27,deigxi,https://www.reddit.com/r/Animemes/comments/deigxi/meta_discussion_thread_5/,TheVexedGerman,10707
1,It literally change my life... really haha,16002,degop4,https://i.redd.it/xhnm9k2vz2r31.jpg,Foodxfoodph,10589
2,Reality is about to hit you,8344,deggnf,https://i.redd.it/o30t0hobu2r31.jpg,zibbon50cal2,243370
3,Japanese akuma,3838,degi21,https://i.redd.it/dkxpahm7v2r31.jpg,3bd0o0o0o0,8401
4,Sauce: date a live,6734,defa4g,https://i.redd.it/p1rlu9sj42r31.jpg,ZiabloDamian,78514
5,Not episode 12 again!!!,5820,defcux,https://i.redd.it/cdlehh8662r31.jpg,Luigi1k3,9394
6,Brains also exists in anime,2316,degjds,https://i.redd.it/ej5rfxk8w2r31.jpg,YaboiJohny,180033
7,I reminisce of the times when watching anime would seem like a sin,5637,def9oy,https://i.redd.it/z196y9mb42r31.jpg,TrapBae69,2158
8,Made this on my phone lmao,3033,defrvf,https://i.redd.it/81t2xnrue2r31.jpg,Kilbo_Fragginz,4900
9,Comin' through!,952,dehtws,https://i.redd.it/hxpaw4x2o3r31.jpg,rnzerk,3041
10,CHOTTO MATTE,1152,deha7d,https://i.redd.it/0knsdrulc3r31.jpg,josgs,106005
11,Sauce: date a live,1228,degrls,https://i.redd.it/hdx602hs13r31.jpg,ZiabloDamian,78510
12,Oh yeah its Soviet time,4789,deehoa,https://i.redd.it/71f1jc97p1r31.jpg,BobJuan0902,67132
13,Nani?,2059,defnal,https://i.redd.it/h99ppiy6c2r31.jpg,1olil0ver,8381
14,You seem to lack the creativity friend,22121,deb5va,https://i.redd.it/eo0145vb80r31.jpg,IncaseAce,1168482
15,Where are all my chemistry boys at?,1440,deg8eg,https://i.redd.it/bc6euqz0p2r31.jpg,HuFade,4932
16,"I'm throwing away my humanity, JoJo!!",1899,def0l8,https://i.redd.it/8kat5gk5z1r31.jpg,MLG50,33783
17,Back to my roots,1254,defrv2,https://v.redd.it/9qlev90ue2r31,Ian3ishere,2493
18,Komi-san was into this world to bring smile and laughter,726,deh2eh,https://i.redd.it/tlewvvnj73r31.png,plastic-pinocchio,1130
19,Give it to me,7022,dec5je,https://i.redd.it/fxlbm4bkn0r31.jpg,Master1718,6053513
