,title,score,id,url,author,author's karma
0,r/AskReddit is looking for moderators!,1046,dctr0v,https://www.reddit.com/r/AskReddit/comments/dctr0v/raskreddit_is_looking_for_moderators/,AskRedditModerators,4689
1,What is something you got rid of years ago that you wish you kept?,21740,dedyzu,https://www.reddit.com/r/AskReddit/comments/dedyzu/what_is_something_you_got_rid_of_years_ago_that/,abstimax,17098
2,"Confucius once said “We all have two lives, the second one starts when you realise you only have one”. When and why did your second life begin?",2265,deh0yw,https://www.reddit.com/r/AskReddit/comments/deh0yw/confucius_once_said_we_all_have_two_lives_the/,Lionoxer,3440
3,"What did you want so badly to be good, but just wasn't?",30426,de8sra,https://www.reddit.com/r/AskReddit/comments/de8sra/what_did_you_want_so_badly_to_be_good_but_just/,SWSU,9230
4,"Girls, what do you think would be the worst part of being a guy?",1441,deeh17,https://www.reddit.com/r/AskReddit/comments/deeh17/girls_what_do_you_think_would_be_the_worst_part/,IAmATuxedoKitty,1899
5,"People who live in ‘vacation destinations’ (Paris, the Bahamas, etc.) what is the most irritating misconception about where you live?",3711,deb603,https://www.reddit.com/r/AskReddit/comments/deb603/people_who_live_in_vacation_destinations_paris/,just_be_respectful,20137
6,Users who upvote questions but don’t answer them: Why?,54906,debq9s,https://www.reddit.com/r/AskReddit/comments/debq9s/users_who_upvote_questions_but_dont_answer_them/,Dat_Chicken04,10649
7,"To The psychologists of reddit that have seen Joker, what all mental illness did you see joker struggle from? And what would the correct term be for the illnesses?",124,dej5m5,https://www.reddit.com/r/AskReddit/comments/dej5m5/to_the_psychologists_of_reddit_that_have_seen/,JohnAppleBee15,483
8,What’s the worst LEGAL thing you can do?,56337,de418x,https://www.reddit.com/r/AskReddit/comments/de418x/whats_the_worst_legal_thing_you_can_do/,zachp787,7679
9,Which propaganda effort was so successful that people still believe in it today ?,5388,de4wgs,https://www.reddit.com/r/AskReddit/comments/de4wgs/which_propaganda_effort_was_so_successful_that/,Actuallymarcuslmao,4825
10,"If all the states of America had to fight it out, which state would win and why?",1232,de9emn,https://www.reddit.com/r/AskReddit/comments/de9emn/if_all_the_states_of_america_had_to_fight_it_out/,J-TL,1103
11,What's a minor mistake that can't be undone?,893,deajsg,https://www.reddit.com/r/AskReddit/comments/deajsg/whats_a_minor_mistake_that_cant_be_undone/,cobaltbpt,3303
12,What’s the best Wi-Fi name you’ve seen?,108,deh19b,https://www.reddit.com/r/AskReddit/comments/deh19b/whats_the_best_wifi_name_youve_seen/,KatieB_Erickson,117
13,"Women of Reddit, what are blow jobs like for you?",2350,de5zuu,https://www.reddit.com/r/AskReddit/comments/de5zuu/women_of_reddit_what_are_blow_jobs_like_for_you/,Darth_Zounds,2586
14,What ILLEGAL activity would be beneficial for the environment?,110,degr6y,https://www.reddit.com/r/AskReddit/comments/degr6y/what_illegal_activity_would_be_beneficial_for_the/,yeetlolbeans,16640
15,What keeps you up at night?,66,dei2dw,https://www.reddit.com/r/AskReddit/comments/dei2dw/what_keeps_you_up_at_night/,noahbjets,166
16,What are the unwritten rules of sex?,318,ded0ll,https://www.reddit.com/r/AskReddit/comments/ded0ll/what_are_the_unwritten_rules_of_sex/,Enricocks,304
17,You're making a Halloween playlist. Which songs do you add?,261,ded7ek,https://www.reddit.com/r/AskReddit/comments/ded7ek/youre_making_a_halloween_playlist_which_songs_do/,sleepyhollow_101,52142
18,What would change if humans had a light that blinked when they were sexually aroused?,4801,de2k5o,https://www.reddit.com/r/AskReddit/comments/de2k5o/what_would_change_if_humans_had_a_light_that/,SpeakerHarlan393,3208
19,Why are you awake?,148,dees98,https://www.reddit.com/r/AskReddit/comments/dees98/why_are_you_awake/,AllStar48,272
